{
  "acceptance_criteria": [
    "Written findings recorded durably: the research record artifact updated (or a successor research record delivered) and a findings comment on this issue.",
    "Per mechanic class — identity/auth, issue lifecycle (open/show/comment/assign/label/state), patch lifecycle (magic-ref submission, push options, revision publication), review (revision addressing, accept/reject), merge and canonical publication, sync/replication read-back — a confirmed/diverged verdict against the research record's documented semantics, with the installed version pinned.",
    "Each UNCONFIRMED fact above resolved, or explicitly recorded as still-unconfirmed with the fallback the dependent unit must use (e.g. comment-convention claiming).",
    "Follow-up issues filed if any divergence rescopes a dependent unit."
  ],
  "description": "## Question\n\nDoes the actually installed Radicle 1.9.x command surface provide the mechanics the replacement will freeze — and where do the documentation-derived semantics, or the facts the research record flags UNCONFIRMED, diverge from installed behavior?\n\nPart of: #538 (predecessor to every implementation unit that relies on documentation-derived command semantics).\n\n## Time box\n\nOne focused session.\n\n## Context\n\nThe `radicle-stock-collaboration-mechanics` research record (2026-07-10, in `.runa/workspace/`) grounds the replacement's mechanics in the official radicle.dev guides and man pages — but `rad` is installed nowhere on this host today, so every command semantic is documentation-derived. The requirements make re-verification against the installed surface an explicit predecessor: implementation must not freeze mechanics on unverified semantics.\n\nFacts the research record flags UNCONFIRMED and this spike must resolve or explicitly bound:\n\n- the non-delegate permission matrix for issue assignment and labeling (decides whether claiming is DID assignment or the documented comment convention);\n- ssh-agent signing behavior in practice on the verification environment;\n- external-COB validation semantics (context only — custom COBs are out of scope this phase);\n- concurrent multi-node single-host operation;\n- whether any HTTP write endpoint exists (expected: none — read-only daemon).\n\nThe verification environment is a bounded scratch setup (rad toolchain plus scratch repository/identities); the production identity and node topology are other units' work.\n\n## Expected output\n\n- [ ] Written findings recorded durably: the research record artifact updated (or a successor research record delivered) and a findings comment on this issue.\n- [ ] Per mechanic class — identity/auth, issue lifecycle (open/show/comment/assign/label/state), patch lifecycle (magic-ref submission, push options, revision publication), review (revision addressing, accept/reject), merge and canonical publication, sync/replication read-back — a confirmed/diverged verdict against the research record's documented semantics, with the installed version pinned.\n- [ ] Each UNCONFIRMED fact above resolved, or explicitly recorded as still-unconfirmed with the fallback the dependent unit must use (e.g. comment-convention claiming).\n- [ ] Follow-up issues filed if any divergence rescopes a dependent unit.\n\n## Dependencies\n\nNone in-graph. Requires a rad 1.9.x toolchain installable in a bounded environment. Deliberately not gated on tesserine/commons#108: this is knowledge acquisition, not implementation of the replacement.",
  "handle": {
    "display": "tesserine/groundwork#596",
    "id": "github:tesserine/groundwork:issue:596"
  },
  "title": "spike: verify the installed Radicle command surface against the documented mechanics"
}