{
  "acceptance_criteria": [
    "The Radicle-native workflow passes end to end on the released and installed surfaces — issues, patches, review, merge, synchronization, replication verification, and closure — with durable read-back evidence recorded.",
    "Repository-wide searches across the epic's repositories for connector-era vocabulary and known structural identifiers (the vendored contract path, the eight operation names, forge tags, `RUNA_FORGE_*`, `GROUNDWORK_FORGE_TYPE`, `[forge]`, provider-scoped handle forms, provider API hosts) find live occurrences only in material explicitly marked historical or superseded and not linked as current guidance.",
    "Schema, manifest, protocol, test, and fixture inventories contain no connector-era entries; the Radicle-era conformance gates assert the absence and are green.",
    "A clean installation, and an upgrade from the final connector-era release, both yield installed Groundwork and Runa surfaces with no adapter-era content — verified by inspecting the installed bundles and served tool surfaces.",
    "Removed configuration and capability declarations are rejected rather than silently accepted: a runa config with `[forge]`, `RUNA_FORGE_*` atoms in the environment, an agentd config carrying the groundwork forge-type, and a methodology manifest declaring forge operations each fail explicitly.",
    "No GitHub, SourceHut, generic-provider, PAT, or connector-handle path remains capable of influencing execution in the composed system.",
    "Current documentation at every home describes only the Radicle-native architecture; historical changelog entries and ADRs remain only where explicitly marked historical or superseded.",
    "Everything found is fixed in-unit or filed as a work-unit before the epic closes; the parent epic's close-state review is satisfied."
  ],
  "dependencies": [
    "work-unit-323470f84ceca4d83b7d30cf88bc046a4de305e40939f0f9ad05d964779f153e",
    "work-unit-721447b336c74170029b3d9f6c9ccd3e1bd8ffa8d487e9118651073aab38063d",
    "work-unit-fe1cd7e4f7089ed517a170133e72df8dcdf7159d47124ae939bd7fa296075c52"
  ],
  "description": "## Summary\n\nThe epic's terminal unit. It runs only after the stock-Radicle workflow has passed end to end and the ecosystem release exists, and it proves **both halves of completion**: (1) the Radicle-native workflow works on the released, installed surfaces, and (2) no executable, configured, installed, tested, or normatively documented connector architecture remains anywhere in the composed system. The epic is not complete because the new path is preferred or because the old path is unreachable in an ordinary run; it completes only when the old architecture has been removed cleanly and the clean state is mechanically demonstrated.\n\nPart of: #538 (terminal).\n\n## Scope\n\n- Verification runs and recorded evidence across groundwork, runa, agentd, base, commons, and the deployed/installed surfaces\n- Fix-or-file for anything found; the epic's close-state review\n\n## Acceptance criteria\n\n- [ ] The Radicle-native workflow passes end to end on the released and installed surfaces — issues, patches, review, merge, synchronization, replication verification, and closure — with durable read-back evidence recorded.\n- [ ] Repository-wide searches across the epic's repositories for connector-era vocabulary and known structural identifiers (the vendored contract path, the eight operation names, forge tags, `RUNA_FORGE_*`, `GROUNDWORK_FORGE_TYPE`, `[forge]`, provider-scoped handle forms, provider API hosts) find live occurrences only in material explicitly marked historical or superseded and not linked as current guidance.\n- [ ] Schema, manifest, protocol, test, and fixture inventories contain no connector-era entries; the Radicle-era conformance gates assert the absence and are green.\n- [ ] A clean installation, and an upgrade from the final connector-era release, both yield installed Groundwork and Runa surfaces with no adapter-era content — verified by inspecting the installed bundles and served tool surfaces.\n- [ ] Removed configuration and capability declarations are rejected rather than silently accepted: a runa config with `[forge]`, `RUNA_FORGE_*` atoms in the environment, an agentd config carrying the groundwork forge-type, and a methodology manifest declaring forge operations each fail explicitly.\n- [ ] No GitHub, SourceHut, generic-provider, PAT, or connector-handle path remains capable of influencing execution in the composed system.\n- [ ] Current documentation at every home describes only the Radicle-native architecture; historical changelog entries and ADRs remain only where explicitly marked historical or superseded.\n- [ ] Everything found is fixed in-unit or filed as a work-unit before the epic closes; the parent epic's close-state review is satisfied.\n\n## Contract inputs\n\n- **Behavior:** every criterion above is a mechanical check with recorded output — searches, inventories, installs, rejections, and the end-to-end evidence chain.\n- **Documentation:** the recorded demonstration is the epic's completion record — readable standalone as proof.\n- **Code quality:** absence is asserted by gates, not by silence (verification-craft; `~/.groundwork/principles/`).\n\n## Dependencies\n\nDepends on: tesserine/commons#116, tesserine/commons#115, #607.",
  "handle": {
    "display": "tesserine/groundwork#610",
    "id": "github:tesserine/groundwork:issue:610"
  },
  "scope": [
    "Verification runs and recorded evidence across groundwork, runa, agentd, base, commons, and the deployed/installed surfaces",
    "Fix-or-file for anything found; the epic's close-state review"
  ],
  "title": "task(integration): zero connector residue — the clean state mechanically demonstrated"
}